[
  {
    "id": "5c6d7e8f-9a0b-1c2d-3e4f-5a6b7c8d9e0f",
    "code": "l3-top-cross-orient",
    "name": "Top Cross (OeLL Beginner)",
    "subtitle": "Orient yellow edges",
    "pattern_from": "Second Layer Complete",
    "pattern_to": "Top Cross",
    "expected_count": 3,
    "category": "Layer-by-Layer Method",
    "case_ids": "{0d1e2f3a-4b5c-6d7e-8f9a-0b1c2d3e4f5a,1e2f3a4b-5c6d-7e8f-9a0b-1c2d3e4f5a6c,2f3a4b5c-6d7e-8f9a-0b1c-2d3e4f5a6b7d}",
    "created_at": "2025-12-04T00:00:00.000Z"
  }
]