[
  {
    "id": "18b34f94-1566-48af-a1ef-b0ac5beda4fe",
    "code": "f2l-ls-fr",
    "name": "F2L",
    "subtitle": "First Two Layers - Last Slot - Front Right",
    "pattern_from": "Cross + Slot FR",
    "pattern_to": "2 Layers",
    "expected_count": 41,
    "category": "F2L",
    "case_ids": "{c32360a6-8659-4261-8e12-5a1cca46b04a,27649c2f-47a1-4939-bfc5-6044f992e654,3807c459-c550-48d3-ac0b-45e5b68266fa,5765d781-cf96-4587-b92c-e7560375351f,961e79e7-c6de-4508-9fdd-d9cb93ad239b,09a52df2-b410-40e1-994a-eee273a019ca,916be96d-64ba-4c64-84ec-52686ae4770d,296c5d4c-472d-44f2-93d6-f65645195f3b,27401725-4e15-4ea3-bcec-e01613c81040,6f6517f9-33d9-42c9-b463-3412615e33aa,40166134-b110-4fa9-965c-bd2a4cd40dcf,e2348cbc-021b-44fd-94d9-8a8238fc92b2,ac372da3-03b0-4a0f-ae58-baed09eb4cf1,069f3786-2678-465f-a30a-9ffc503907bc,8a758201-338e-4fcc-817e-4b692959a92f,64590abe-0eec-46f3-a614-a2934636f446,9de1f346-af03-4ce6-bc48-36a498c218e4,57fb97df-86d7-4d84-bbf4-a023719ce991,2c4441c0-8881-43fb-a94d-6bc3d775ca56,f86e89b9-257e-47c5-b9a1-48f947565e17,0f9d200e-c6ec-4ae8-bc70-369560746d50,dfb1fc12-378c-4b4c-81f9-954a35f5b0cd,b26cd4cb-9a3a-48d2-aba8-1c4c8bd7a990,f1b219f2-f681-444e-917d-a33591149a34,c5eb35cb-4981-43c0-ae12-2bd95fe1040a,a17e7c80-df9b-41d6-81d9-fa0abda0cb60,a1662e61-42b9-466f-84fe-2a832fa544cf,3ac3b273-0fe5-49e4-9f61-d5dae3df00f6,d158885f-b377-47b3-a939-2759de40071b,32a6c8f2-54a9-45da-87f2-3053d5c08cf5,3810f0b5-e33c-4943-ad76-0067a1385163,39831d27-728c-4664-b058-700a0523b0c7,7c166816-ec8a-4bec-8205-d94b1089ad58,d9906341-3bd9-4d7b-a33f-5b9ac4bed10f,808bd3dc-0167-4611-9238-dbfff4e54358,c9b8a00c-ee08-4e77-a1d0-35ab4288f7ea,7dc06020-5025-4ce7-8a3a-615178e98c81,83666531-9176-4d1b-94fc-2cba34f65969,8c06a47d-2d67-4691-b4ad-653bcb80fb26,25f3ac3a-bd1f-4d3d-8916-46b03fb59efd,2e678e65-ae5b-4ef8-a69c-00fcbb2749a1}",
    "created_at": "2025-10-23T19:16:46.741Z"
  }
]