[
  {
    "id": "e3c4d5f6-a7b8-9012-cdef-345678901234",
    "code": "roux-lse-l4e",
    "name": "LSE-L4E",
    "subtitle": "Last 4 Edges Permutation (Roux 4c)",
    "pattern_from": null,
    "pattern_to": null,
    "expected_count": 4,
    "category": "Roux Method - Last Six Edges",
    "case_ids": [
      {"id": "14e11111-1111-1111-1111-111111111111", "code": "3X3-LSE-L4E01"},
      {"id": "14e22222-2222-2222-2222-222222222222", "code": "3X3-LSE-L4E02"},
      {"id": "14e33333-3333-3333-3333-333333333333", "code": "3X3-LSE-L4E03"},
      {"id": "14e44444-4444-4444-4444-444444444444", "code": "3X3-LSE-L4E04"}
    ],
    "created_at": "2025-12-18T15:47:23.463Z"
  }
]