[
  {
    "id": "8dfd8ef3-5e4a-4888-8c09-edc72578edd4",
    "code": "pcll",
    "name": "PcLL",
    "subtitle": "Permutation of the Corners",
    "pattern_from": "Top Oriented",
    "pattern_to": "Top Corners Permuted",
    "expected_count": 2,
    "category": "Last Layer - Intermediate",
    "case_ids": "{e3cafb06-4419-51fe-b24a-7ceccfc857bc,adeacbce-2b37-53f7-a85f-56fa81b964c4}",
    "created_at": "2025-10-23T19:16:46.741Z"
  }
]