[
  {
    "id": "7e8f9a0b-1c2d-3e4f-5a6b-7c8d9e0f1a2b",
    "code": "l3-top-corners-position",
    "name": "Top Corners Position",
    "subtitle": "Permute yellow corners",
    "pattern_from": "Top Corners Oriented",
    "pattern_to": "Top Corners Positioned",
    "expected_count": 1,
    "category": "Layer-by-Layer Method",
    "case_ids": [
      {"id": "2f3a4b5c-6d7e-8f9a-0b1c-2d3e4f5a6b7c", "code": "3X3-LBL-TOP-CORNERS-POSITION-01"}
    ],
    "created_at": "2025-12-04T00:00:00+00:00"
  }
]