[
  {
    "id": "9a4b8c3d-5e6f-7a2b-3c4d-5e6f7a8b9c0d",
    "code": "ortega-pbl",
    "name": "Ortega PBL",
    "subtitle": "2x2 - Permutation of Both Layers",
    "pattern_from": "Opposite Face Oriented",
    "pattern_to": "Solved",
    "expected_count": 5,
    "category": "2x2 - Ortega Method",
    "case_ids": [
      {"id": "b8c9d0e1-f2a3-4567-b123-678901234567", "code": "Ortega-PBL-1"},
      {"id": "c9d0e1f2-a3b4-5678-c123-789012345678", "code": "Ortega-PBL-2"},
      {"id": "d0e1f2a3-b4c5-6789-d123-890123456789", "code": "Ortega-PBL-3"},
      {"id": "e1f2a3b4-c5d6-7890-e123-901234567890", "code": "Ortega-PBL-4"},
      {"id": "f2a3b4c5-d6e7-8901-f123-012345678901", "code": "Ortega-PBL-5"}
    ],
    "created_at": "2025-01-10T00:00:00.000Z"
  }
]