[
  {
    "id": "96169d2a-b5bb-4c40-ae0f-e44a418c255d",
    "code": "oell",
    "name": "OeLL",
    "subtitle": "Orientation of the Edges",
    "pattern_from": "2 Layers",
    "pattern_to": "Top Edges Oriented",
    "expected_count": 3,
    "category": "Last Layer - Intermediate",
    "case_ids": "{7c0fa2ff-ecc8-5280-90c6-e6980e439397,38e4ae9c-99c0-5e79-8e89-1a4e68045417,4caf1181-bb2b-5fd2-a119-44e79e853b63}",
    "created_at": "2025-10-23T19:16:46.741Z"
  }
]